{
  "sourceDocuments": [
    {
      "sourceDocumentId": "source-document-customer-profile",
      "file": ".ai-sow/inputs/analyze-requirement/customer-profile.md",
      "originalName": "customer-profile.md",
      "sha256": "21613a2790bebc39d5d4c1c66073d6544bfbdefd1783cefef494633e82270e20"
    }
  ],
  "normalizedItems": [
    {
      "normalizedItemId": "norm-customer-profile-create",
      "sourceDocumentId": "source-document-customer-profile",
      "title": "创建客户档案",
      "statement": "业务人员可以登记客户的基本资料并获得唯一客户编号。"
    },
    {
      "normalizedItemId": "norm-customer-profile-view",
      "sourceDocumentId": "source-document-customer-profile",
      "title": "查询客户档案",
      "statement": "获授权的业务人员可以按客户编号查询已登记的客户资料。"
    },
    {
      "normalizedItemId": "norm-customer-profile-maintain",
      "sourceDocumentId": "source-document-customer-profile",
      "title": "维护客户资料",
      "statement": "业务人员可以修正客户联系方式，并保留变更责任人和变更时间。"
    }
  ],
  "epics": [
    {
      "epicId": "epic-customer-management",
      "type": "BUSINESS",
      "name": "客户档案管理",
      "description": "为客户服务和订单履约提供统一、可追溯的客户档案能力。",
      "involvedSystemsData": "业务范围涉及客户门户中的客户基本资料、联系方式和业务可见状态。",
      "targetOutcome": "业务人员能够使用唯一客户编号完成客户识别，减少重复登记和资料不一致。",
      "commonConstraintsOutOfScope": "本期不包含客户营销画像、信用评分和跨企业客户主数据治理。",
      "source": {
        "type": "SOURCE_INPUT",
        "normalizedItemIds": [
          "norm-customer-profile-create",
          "norm-customer-profile-view",
          "norm-customer-profile-maintain"
        ]
      }
    }
  ],
  "features": [
    {
      "featureId": "feature-customer-profile-registration",
      "epicId": "epic-customer-management",
      "name": "登记并维护客户档案",
      "description": "业务人员登记客户基本资料后获得唯一客户编号，并可修正联系方式且追溯修改责任。",
      "involvedSystemsData": "客户门户保存客户基本资料、联系方式、修改责任人和修改时间。",
      "constraintsNfr": "只有获授权的业务角色可以维护客户档案，所有修改均需保留业务审计记录。",
      "source": {
        "type": "SOURCE_INPUT",
        "normalizedItemIds": [
          "norm-customer-profile-create",
          "norm-customer-profile-maintain"
        ]
      }
    },
    {
      "featureId": "feature-customer-profile-query",
      "epicId": "epic-customer-management",
      "name": "按客户编号查询档案",
      "description": "获授权的业务人员输入唯一客户编号后，可以查看该客户已登记且在其业务权限内的资料。",
      "source": {
        "type": "SOURCE_INPUT",
        "normalizedItemIds": ["norm-customer-profile-view"]
      }
    }
  ]
}
